{
    "alias": "Annotation_12345",
    "imageRef": {
        "alias": "Image_12345"
    },
    "files": [
        {
            "filename": "project/folder/file.dcm",
            "checksumMethod": "SHA256",
            "checksum": "123456789012345678901234567890123456789012345678901234567890abcd",
            "filetype": "dcm"
        },
        {
            "filename": "project/folder/file.json",
            "checksumMethod": "SHA256",
            "checksum": "abcdefabcdefabcdefabcdefabcdefabcdefabcdefabcdefabcdefabcdefabcd",
            "filetype": "json"
        }
    ],
    "attributes": null
}
